Campaign,Ad group,Ad type,Headline 1,Headline 2,Headline 3,Headline 4,Headline 5,Headline 6,Headline 7,Headline 8,Headline 9,Headline 10,Headline 11,Headline 12,Headline 13,Headline 14,Headline 15,Description 1,Description 2,Description 3,Description 4,Path 1,Path 2,Final URL,Status
Search-ES-Local-Mexico-2026,Visitar SLP,Responsive search ad,San Luis Way: tu guía de SLP,"Brunch, parques y eventos SLP",Centro Histórico UNESCO en SLP,Brunch Potosino: Top 10,Parque Tangamanga: guía 2026,Huasteca Potosina en 1 día,¿Visitas SLP este verano?,Newsletter gratis SLP,La guía más completa de SLP,Eventos esta semana en SLP,SLP para visitantes 2026,Verificado en abril 2026,Mejores restaurantes de SLP,¿Qué hacer este fin? SLP,Recibe el SLP semanal,"Eventos, restaurantes, parques. La guía local de SLP. Newsletter gratis cada lunes.","Brunch potosino, Centro UNESCO, Tangamanga, Huasteca. Toda la info que necesitas.","Periodistas, expats y locales nos leen. Newsletter gratis, sin spam, en 10 segundos.","Cobertura verificada de SLP: eventos, comida, transporte, colonias. Forma inteligente.",eventos,slp,https://www.sanluisway.com/es?utm_source=google&utm_medium=cpc&utm_campaign=search_es_local&utm_content=visitar_slp,Paused
Search-ES-Local-Mexico-2026,Mudarse a SLP,Responsive search ad,¿Pensando en mudarte a SLP?,Guía completa para expats SLP,Costo de vida SLP abril 2026,SLP vs San Miguel de Allende,Mejores colonias en SLP,Vivir en SLP: lo bueno y malo,Newsletter para expats en SLP,Comunidad expat en SLP,"Salud, escuelas y vida en SLP",La guía local más completa,"Visa, renta, transporte en SLP",Consejos gratis cada lunes,,,,"Guía verificada para expats: costo de vida, colonias, escuelas, salud. Newsletter gratis.","¿Mudarte a SLP en 2026? La guía honesta sin influencer hype. Verificada abril 2026.","Comparativos SLP vs San Miguel, costos reales, comunidad expat.","2,800+ personas leen el SLP semanal: periodistas, expats, locales. Únete gratis.",mudarse,slp,https://www.sanluisway.com/es/resources/expat-guide?utm_source=google&utm_medium=cpc&utm_campaign=search_es_local&utm_content=mudarse_slp,Paused
Search-ES-Local-Mexico-2026,Brand Defense,Responsive search ad,San Luis Way: guía oficial SLP,Sitio oficial de San Luis Way,Newsletter semanal gratis SLP,Guía completa de SLP,"Eventos, comida, transporte",Lo leen 2800+ personas,Verificado abril 2026,Sanluisway.com,Tu guía local de SLP,,,,,,,"San Luis Way: guía local independiente de SLP. Newsletter gratis cada lunes.","Si buscas información honesta de SLP, llegaste al lugar. 2,800+ suscriptores activos.",,,oficial,slp,https://www.sanluisway.com/?utm_source=google&utm_medium=cpc&utm_campaign=search_es_local&utm_content=brand,Paused
Search-DE-JA-Expat-Moonshot,DE-Umzug-Mexiko,Responsive search ad,Auswandern nach Mexiko 2026,Leben in San Luis Potosí,Insider-Guide für Expats SLP,Newsletter Mexiko-Leben,"Visa, Miete, Leben in SLP",Auswanderer-Community SLP,Aktualisiert April 2026,Kostenloser Newsletter Mexiko,Mexiko-Auswanderer SLP,Der ehrliche Mexiko-Guide,SLP statt CDMX,,,,,"Verifizierter Guide für deutsche Auswanderer in SLP: Visa, Wohnen, Schulen, Gesundheit.","Sie planen Mexiko 2026? Der ehrliche Guide ohne Influencer-Hype. April 2026 Update.","Visa, Wohnen, Schulen, Krankenversicherung in San Luis Potosí.",,umzug,mexiko,https://www.sanluisway.com/de/resources/living-guide?utm_source=google&utm_medium=cpc&utm_campaign=search_de_ja&utm_content=umzug_mexiko,Paused
Search-DE-JA-Expat-Moonshot,JA-Mexico-Iju,Responsive search ad,メキシコ移住ガイド 2026,サン・ルイス・ポトシで暮らす,移住者向けインサイダーガイド,メキシコ生活ニュースレター,ビザ・住居・生活費を確認,メキシコ駐在者コミュニティ,2026年4月更新,無料週刊メールマガジン,,,,,,,,"サン・ルイス・ポトシ移住ガイド。ビザ、住居、学校、医療を網羅。","2026年メキシコ移住の正直なガイド。誇大広告なし、4月更新。",,,iju,mexico,https://www.sanluisway.com/ja/resources/living-guide?utm_source=google&utm_medium=cpc&utm_campaign=search_de_ja&utm_content=mexico_iju,Paused
